{
  "$schema": "https://json-schema.org/draft/2020-12/schema",
  "$id": "https://deepfield.dev/content/meleeAttachments.schema.json",
  "title": "meleeAttachments",
  "type": "object",
  "additionalProperties": false,
  "required": [
    "$schema",
    "table",
    "generated",
    "rows"
  ],
  "properties": {
    "$schema": {
      "const": "deepfield-content/1"
    },
    "table": {
      "type": "string"
    },
    "generated": {
      "type": "string"
    },
    "sourceSha": {
      "type": "string"
    },
    "rows": {
      "type": "array",
      "items": {
        "type": "object",
        "additionalProperties": false,
        "required": [
          "id",
          "slot",
          "damageFactor",
          "speedFactor",
          "reachFactor",
          "recipe"
        ],
        "properties": {
          "id": {
            "type": "string"
          },
          "slot": {
            "type": "string",
            "enum": [
              "Edge",
              "Grip",
              "CoreInfusion",
              "Counterweight",
              "ChargeCell"
            ]
          },
          "damageFactor": {
            "type": "number"
          },
          "speedFactor": {
            "type": "number"
          },
          "reachFactor": {
            "type": "number"
          },
          "applies": {
            "type": "string"
          },
          "recipe": {
            "type": "object",
            "additionalProperties": {
              "type": "integer"
            },
            "propertyNames": {
              "enum": [
                "Alloy",
                "Flux",
                "Plating",
                "Gravium"
              ]
            }
          }
        }
      }
    }
  }
}
